{
  "server_time": "2026-10-27T10:05:12.345Z",
  "accepted": [
    "019a2b3c-4d5e-7f00-8a00-000000000030"
  ],
  "last_seq": 412,
  "rejected": [
    {
      "id": "019a2b3c-4d5e-7f00-8a00-000000000036",
      "code": "chain_gap",
      "expected_seq": 413
    }
  ],
  "media_missing": [
    "019a2b3c-4d5e-7f00-8a00-000000000024"
  ]
}
